{
  "$schema": "../../schemas/experiment.schema.json",
  "schema_version": "1.0.0",
  "experiment_id": "vrx2019-station-keeping-practice0-fast-pd",
  "benchmark": {
    "name": "vrx-2019-station-keeping",
    "revision": "a62df11109ee95c206111c37a37c60d39bc7b705",
    "protocol_revision": "public-vrx-2019-task-info-mean-pose-error-a62df111",
    "score_direction": "minimize",
    "scorer": {"name": "vrx-2019-station-keeping-scorer", "revision": "a62df11109ee95c206111c37a37c60d39bc7b705"}
  },
  "controller": {
    "name": "saturation-aware-fast-pd-stock-t-thrusters",
    "source": "ros/vrx_controller_ros",
    "revision": "fast-pd-v1-2026-09-03",
    "command": ["../../scripts/run_vrx_trial"],
    "parameters": {
      "layout": "T",
      "localization_topic": "/wamv/robot_localization/odometry/filtered",
      "goal_topic": "/vrx/station_keeping/goal",
      "diagnostics_topic": "/vrx_controller/diagnostics",
      "control_hz": 10.0,
      "world_frame": "ENU",
      "position_source": "/wamv/sensors/gps/gps/fix",
      "datum_latitude_deg": 21.30996,
      "datum_longitude_deg": -157.8901,
      "wamv_locked": false,
      "thruster_mapping": "stock_mappingType_1_glf",
      "kp": [80.0, 80.0, 250.0],
      "kd": [250.0, 250.0, 600.0],
      "output_min": [-200.0, -100.0, -349.0],
      "output_max": [480.0, 240.0, 349.0]
    }
  },
  "container": {"image": "vrx-record-lab:2019-amd64", "digest": "sha256:c67d1d45abebe34ec6c5a101cb8bf16320855807c58f6d0775caabec5e26ab98"},
  "task": {
    "name": "station_keeping",
    "parameters": {
      "world": "/opt/vrx_ws/src/vrx/vrx_gazebo/worlds/2019_practice/stationkeeping0.world",
      "initial_state_duration_s": 10.0,
      "ready_state_duration_s": 10.0,
      "running_state_duration_s": 300.0,
      "wall_timeout_s": 600.0
    }
  },
  "trials": {
    "seeds": [10],
    "seed_provenance": "Pinned public practice world stationkeeping0.world random_seed=10.",
    "environment": {"world": "/opt/vrx_ws/src/vrx/vrx_gazebo/worlds/2019_practice/stationkeeping0.world", "wind_seed": "world-defined:10", "waves": "world-defined"}
  },
  "execution": {"command": ["../../scripts/run_vrx_trial"], "timeout_s": 700.0, "cwd": null}
}
